"","links","topics","dates","speeches_DE","topics_EN","speeches_EN"
"1","https://www.bundesregierung.de/breg-de/aktuelles/rede-von-bundeskanzlerin-merkel-zur-uebergabe-der-2-euro-gedenkmuenze-brandenburg-am-14-februar-2020-in-berlin-1722152","Rede von Bundeskanzlerin Merkel zur Übergabe der 2-Euro-Gedenkmünze „Brandenburg“ am 14. Februar 2020 in Berlin",2020-02-14,"Sehr geehrter Herr Bundesratspräsident, lieber Herr Woidke,sehr geehrte Frau Parlamentarische Staatssekretärin, liebe Frau Hagedorn,sehr geehrter Herr Truxa,meine Damen und Herren, in der zweiten Jahreshälfte wird Deutschland die EU-Ratspräsidentschaft innehaben. Bei allem, was wir uns dafür vornehmen, wissen wir: Europa gewinnt seine Identität und Stärke vor allem aus der Vielfalt seiner Regionen. Mit den 2-Euro-Gedenkmünzen wollen wir die besondere Bedeutung der Bundesländer für die Bundesrepublik Deutschland und Europa würdigen. Dabei erfolgt die Ausgabe der Münzen seit 2006 in der Reihenfolge der Präsidentschaft im Bundesrat. Deshalb ist in diesem Jahr Brandenburg an der Reihe. Die Gedenkmünzen zeigen beeindruckende und historisch bedeutsame Bauwerke. Sowohl Herr Woidke als auch ich hätten weitere historisch bedeutsame Bauwerke in Brandenburg gefunden, aber es nimmt nicht wunder, dass die Wahl dann doch auf das Schloss Sanssouci gefallen ist. Das Schloss Sanssouci zählt bereits seit fast 30 Jahren zum UNESCO-Welterbe – also etwa so lange, wie wir die Deutsche Einheit haben. Sanssouci, das heißt übersetzt ja nichts anderes als „ohne Sorge“ – und damit war auch für den Namen des Schlosses gesorgt. Das einzigartige Ensemble aus Prachtbauten und Parkanlage ist sehenswert. Wahrscheinlich war auch jeder von Ihnen hier schon einmal dort. Wenn nicht, dann müssen Sie das unbedingt nachholen. Millionen von Besuchern waren schon dort. So findet Sanssouci nun auch eine Würdigung mit der neuen Gedenkmünze. Der Entwurf der Bildseite stammt passenderweise aus einer Brandenburger Werkstatt – genauer gesagt: von Herrn Jordi Truxa aus Neuenhagen. Er ist hier kein unbekannter Gast, denn er hat auch die Bildseite der Gedenkmünze Sachsen 2016 mit dem Dresdner Zwinger gestaltet. Herr Truxa, also herzlichen Dank zum zweiten Mal. Nun möchte ich das Wort an die sehr viel sachkundigere Parlamentarische Staatssekretärin übergeben. Frau Hagedorn, Sie haben das Wort.","Speech by Federal Chancellor Merkel on the presentation of the 2-euro commemorative coin ""Brandenburg"" on February 14, 2020 in Berlin","Dear President of the Bundesrat, dear Mr. Woidke, dear Mrs. Parliamentary State Secretary, dear Mrs. Hagedorn, dear Mr. Truxa, ladies and gentlemen, Germany will hold the EU Council Presidency in the second half of the year. Whatever we do, we know that Europe derives its identity and strength primarily from the diversity of its regions. With the 2-euro commemorative coins, we want to honor the special importance of the federal states for the Federal Republic of Germany and Europe. Since 2006, the coins have been issued in the order of the presidency in the Bundesrat. That's why it's Brandenburg's turn this year. The commemorative coins show impressive and historically significant buildings. Both Mr. Woidke and I would have found other historically significant buildings in Brandenburg, but it is not surprising that the choice fell on Sanssouci Palace. Sanssouci Palace has been a UNESCO World Heritage Site for almost 30 years - about as long as we have German unity. Sanssouci, which translates to nothing other than ""without worries"" - and this also provided for the name of the palace. The unique ensemble of magnificent buildings and park is worth seeing. Probably every one of you here has been there before. If not, then you definitely need to catch up. Millions of visitors have been there. Sanssouci is now also being honored with the new commemorative coin. Appropriately enough, the draft of the picture side came from a Brandenburg workshop – more precisely: from Mr. Jordi Truxa from Neuenhagen. He is not an unknown guest here, as he also designed the face of the 2016 Saxony commemorative coin with the Dresden Zwinger. Mr. Truxa, thank you very much for the second time. I would now like to hand over the floor to the much more knowledgeable Parliamentary State Secretary. Ms. Hagedorn, you have the floor."
"2","https://www.bundesregierung.de/breg-de/aktuelles/rede-von-bundeskanzlerin-merkel-zur-eroeffnung-des-11-integrationsgipfels-am-2-maerz-2020-in-berlin-1726948","Rede von Bundeskanzlerin Merkel zur Eröffnung des 11. Integrationsgipfels am 2. März 2020 in Berlin",2020-03-02,"Lieber Bundesinnenminister Horst Seehofer,liebe Annette Widmann-Mauz, die Du die ganze organisatorische Arbeit mit Deinem Stab gemacht hast,lieber Kanzleramtsminister Helge Braunund Sie alle, die Sie heute an diesem Integrationsgipfel teilnehmen, ich begrüße Sie ganz herzlich. Es ist der 11. Integrationsgipfel. Ich möchte dieses Mal ganz besonders Herrn Minister Mendicino begrüßen. A warm welcome to you. You arrived from Canada. Sie sind als Minister für Einwanderung, Flüchtlinge und Staatsbürgerschaft der erste ausländische Gast bei einem solchen Integrationsgipfel. Das deutet schon darauf hin, dass wir heute ein ganz besonderes Hauptthema haben. Deshalb begrüße ich auch Sozial- und Arbeitsminister Heil und ebenso Wirtschaftsminister Peter Altmaier. Nach unserer heutigen Sitzordnung sitzen Vertreter der Migrationsverbände zwischen den Ministern. Deshalb muss sich mein Auge an diese neue Konstellation erst gewöhnen. Obwohl wir ein Hauptthema haben, stehen wir alle natürlich unter dem Eindruck des Anschlags von Hanau am 19. Februar. Ich möchte deshalb zu Beginn der Veranstaltung auch an die Menschen erinnern, die Opfer rechtsextremer, rassistischer und islamfeindlicher Gewalt oder islamfeindlichen Hasses wurden. Ich darf allen sagen, dass wir mit den Familien und Angehörigen trauern und dass wir natürlich sehr bedrückt sind, dass es bisher nicht gelungen ist, solche Taten zu stoppen, sondern dass es eine ganze Reihe von Dingen gab, die uns sehr, sehr umtreiben. In einem Vorgespräch mit Migrantenverbänden – Annette Widmann-Mauz hatte eingeladen; Horst Seehofer war auch dabei – haben wir heute gesagt, dass wir noch mehr tun müssen, weil wir mit den Ergebnissen, die wir haben, natürlich überhaupt nicht zufrieden sein können. Jeder Mensch, der in diesem Lande lebt, muss sich sicher fühlen können und muss in seiner Würde akzeptiert werden. Das gibt uns auch das Grundgesetz auf. Sicherheit ist die Voraussetzung dafür, dass man in seiner Würde überhaupt akzeptiert wird. Wir haben leider gelernt, dass Worte auch zu Taten werden können und daraus schreckliche Gewalt erwachsen kann. Das heißt, wir müssen weit vor der Anwendung von Gewalt aufmerksam sein – es geht um unsere Diskussionskultur, um die Wortwahl, um das gesellschaftliche Klima. Heute sitzen hier Vertreter aus verschiedensten gesellschaftlichen Bereichen, die ich alle begrüße – von Wohlfahrtsverbänden bis zu Wirtschaftsverbänden –, und die uns dabei helfen können. Politik hat eine zentrale Verantwortung, aber die Gesellschaft ist viel, viel umfassender. Letztlich geht es um unser Selbstverständnis. Gestern ist das Fachkräfteeinwanderungsgesetz in Deutschland in Kraft getreten. Wir haben uns lange mit der Frage der Einwanderung beschäftigt und gesagt: Ja, wir haben in verschiedener Form Einwanderung, aber wir wollen jetzt auch ganz bewusst auf Menschen setzen, deren fachliche Kompetenz wir brauchen. Das haben Wirtschaft, Gewerkschaften und Politik gemeinsam gesagt; und das unterscheidet unsere heutige Betrachtungsweise doch sehr von der Betrachtungsweise in der Zeit zu Anfang der 60er Jahre, als, wie sie genannt wurden, Gastarbeiter zu uns kamen. Schon in diesem Wort hat sich ausgedrückt, dass wir dachten: Na ja, sie kommen; und dann gehen sie auch wieder. Wir haben positive Entwicklungen erkannt, aber auch die Aufgaben, die für die zweite, dritte und vierte Generation erwachsen sind. Wir wissen, dass Integration keine Sache nur einer Generation ist. Aber wir wissen inzwischen auch, dass es nicht nur um Integration geht, sondern dass es auch darum geht, miteinander zu leben. Es gibt nicht immer das „Wir“ und das „Ihr“, wie es Annette Widmann-Mauz heute gesagt hat, sondern wir sind eine Gesellschaft. Das ist der zentrale Satz. Deshalb wollen wir heute nicht nur darüber sprechen, was wir im Bereich der Vorintegration tun können, sondern wir wollen auch ein bisschen von Ihren Erfahrungen profitieren, Herr Mendicino. Deshalb danke ich für die Idee, Herrn Mendicino hierher einzuladen. Ich freue mich auf die Diskussion und darauf, miteinander verschiedene Fragen durchzugehen, zum Beispiel: Was ist wichtig für jemanden, der in unsere Gesellschaft kommt; was sollte er wissen, bevor er überhaupt ankommt? Das wird eine spannende Diskussion, die wir allerdings ein bisschen dadurch verändern, dass wir uns zu Beginn hier in diesem Kreis von drei Vertretern der Migrantenverbände zum gesellschaftlichen Klima berichten lassen, was wir in der Vorveranstaltung mit den Migrantenverbänden besprochen haben, sodass wir eine Brücke schlagen. Dann kommen wir zu unserem zentralen Punkt. So weit von meiner Seite die Einführung.","Speech by Federal Chancellor Merkel at the opening of the 11th integration summit on March 2, 2020 in Berlin","Dear Federal Interior Minister Horst Seehofer, dear Annette Widmann-Mauz, who did all the organizational work with your staff, dear Chancellery Minister Helge Braun, and all of you who are taking part in this integration summit today, I would like to extend a warm welcome to you. It is the 11th integration summit. This time I would like to give a special welcome to Minister Mendicino. A warm welcome to you. You arrived from Canada. As Minister for Immigration, Refugees and Citizenship, you are the first foreign guest at such an integration summit. This already indicates that we have a very special main topic today. That is why I also welcome Minister for Social Affairs and Labor Heil and Minister for Economic Affairs Peter Altmaier. According to our seating arrangement today, representatives of the migration associations sit between the ministers. That's why my eyes first have to get used to this new constellation. Although we have one main topic, we are of course all under the impression of the Hanau attack on February 19th. At the beginning of the event, I would therefore also like to remind people of the people who were victims of right-wing extremist, racist and Islamophobic violence or Islamophobic hatred. I can say to everyone that we mourn with the families and relatives and that we are of course very depressed that it has not yet been possible to stop such acts, but that there have been a whole range of things that concern us very, very much. In a preliminary talk with migrant associations - Annette Widmann-Mauz had invited; Horst Seehofer was also there - we said today that we still have to do more because of course we cannot be at all satisfied with the results we have. Everyone who lives in this country must be able to feel safe and must be accepted in their dignity. The Basic Law also gives us that. Security is the prerequisite for being accepted in your dignity at all. Unfortunately, we have learned that words can also translate into deeds and that terrible violence can result. That means we have to be vigilant well before the use of force - it's about our discussion culture, the choice of words, the social climate. Today we have representatives from all walks of life, all of whom I welcome - from charities to business groups - who can help us with this. Politics has a central responsibility, but society is much, much broader. Ultimately, it is about our self-image. The Skilled Immigration Act came into force in Germany yesterday. We spent a long time dealing with the question of immigration and said: Yes, we have immigration in various forms, but we now want to consciously rely on people whose professional skills we need. Business, trade unions and politics all said this together; and that is what differentiates our present way of looking at things very much from the way of looking at things at the beginning of the 1960s, when, as they were called, guest workers came to us. This word already expressed the fact that we thought: well, they are coming; and then they go again. We have recognized positive developments, but also the tasks that have arisen for the second, third and fourth generation. We know that integration is not just a matter of one generation. But we now also know that it's not just about integration, it's also about living together. There is not always ""we"" and ""you"", as Annette Widmann-Mauz said today, but we are a society. That is the central sentence. That's why today we don't just want to talk about what we can do in the area of pre-integration, but we also want to benefit a bit from your experience, Mr. Mendicino. So I thank you for the idea of inviting Mr. Mendicino here. I look forward to the discussion and going through different questions together, for example: what is important for someone who comes into our society; what should he know before he even arrives? This will be an exciting discussion, which we will change a bit by having three representatives of the migrant associations report to us here in this circle on the social climate at the beginning, which we discussed with the migrant associations at the previous event, so that we can build a bridge . Then we come to our central point. So far from my side the introduction."
"3","https://www.bundesregierung.de/breg-de/aktuelles/rede-von-bundeskanzlerin-merkel-im-rahmen-der-covid-19-geberkonferenz-am-4-mai-2020-in-berlin-videokonferenz--1750234","Rede von Bundeskanzlerin Merkel im Rahmen der COVID-19-Geberkonferenz  am 4. Mai 2020 in Berlin (Videokonferenz)",2020-05-04,"Sehr geehrte Frau Präsidentin, liebe Ursula,liebe Kollegen und Freunde, ich bin sehr froh, heute für Deutschland bei dieser Konferenz dabei zu sein, denn sie zeigt ein Signal der Hoffnung in so schwierigen Stunden für viele Länder. Die Pandemie ist eine globale Herausforderung. Und deshalb können wir sie auch nur global besiegen. Alle, die heute mitwirken, verpflichten sich dem Ziel, gemeinsam an einem Impfstoff zu arbeiten sowie Medikamente und diagnostische Mittel bereitzustellen. Deutschland ist sehr gerne und aus Überzeugung dabei. Die G20 insgesamt hat die Verpflichtung abgegeben, sich zu engagieren. Sie verkörpert immerhin 80 Prozent des Bruttoinlandsprodukts der Welt. Ich bin der Kommissionspräsidentin Ursula von der Leyen sehr, sehr dankbar dafür, dass sie die Initiative ergriffen hat, um Akteure aus dem politischen, dem privaten und dem Stiftungsbereich zusammenzubringen. Ich bedanke mich bei der WHO und bei den Vereinten Nationen dafür, dass sie diese Veranstaltung unterstützen. Wir sind bereit, auch neue Wege zu gehen. Wir müssen flächendeckende Tests für möglichst viele Menschen auf der Welt bereitstellen. Wir brauchen Partnerschaften insbesondere mit unseren afrikanischen Freunden und mit vielen anderen Ländern. Wir müssen neue Wege gehen, wenn es darum geht, einerseits einen Impfstoff zu entwickeln, andererseits aber auch schon die Produktion dieses Impfstoffs vorzubereiten. Wir tun dies alles mit einem gemeinsamen Ziel: möglichst vielen Menschen angesichts einer solchen Pandemie Gesundheit zu ermöglichen. Deutschland fühlt sich diesem Ziel verpflichtet. Wir werden uns mit 525 Millionen Euro direkt an diesem Pledging beteiligen; und wir werden unsere Verpflichtungen für die globale Gesundheit insgesamt mit etwa 1,3 Milliarden Euro weiterführen. Dies tun wir, wenn es etwa um Gavi und um den Ausbau und die Stärkung von Gesundheitssystemen vor allem in vielen Ländern des Südens geht. Wir werden auch unsere humanitäre Hilfe erhöhen, da wir wissen, dass diese Pandemie dramatische Auswirkungen hat. Wir sehen zum Beispiel auch, dass in Afrika die Malariaerkrankungen zunehmen. Die Schäden, die durch die Pandemie auch mitausgelöst werden, sind also viel vielfältiger als nur diese Pandemie selbst. Ich halte diese heutige Konferenz in einer Zeit, in der wir nicht immer multilateral so zusammenarbeiten, wie ich mir das wünsche, für ein ganz wichtiges Signal. Es ist eine Stunde der Hoffnung. Ich danke allen, die dabei sind. Deutschland wird sich tatkräftig einbringen und die Entwicklung weiterverfolgen. Wir wissen, dass dies nicht die letzte Konferenz dieser Art war und dass noch mehr Anstrengungen nötig sein werden. Herzlichen Dank.","Speech by Federal Chancellor Merkel at the COVID-19 donor conference on May 4, 2020 in Berlin (video conference)","Dear Madam President, dear Ursula, dear colleagues and friends, I am very happy to be present for Germany at this conference today, because it shows a signal of hope in such difficult times for many countries. The pandemic is a global challenge. And that's why we can only defeat them globally. Everyone involved today is committed to the goal of working together on a vaccine and providing medicines and diagnostic tools. Germany is very happy to be there and out of conviction. The G20 as a whole has made a commitment to get involved. After all, it embodies 80 percent of the world's gross domestic product. I am very, very grateful to Commission President Ursula von der Leyen for taking the initiative to bring together actors from the political, private and foundation sectors. I thank the WHO and the United Nations for supporting this event. We are ready to break new ground. We need to provide widespread testing to as many people around the world as possible. We need partnerships, especially with our African friends and with many other countries. We have to break new ground when it comes to developing a vaccine on the one hand, but also to preparing the production of this vaccine on the other. We do all this with a common goal: to enable as many people as possible to be healthy in the face of such a pandemic. Germany is committed to this goal. We will participate directly in this pledging with 525 million euros; and we will continue our global health commitments totaling approximately €1.3 billion. We do this when it comes to Gavi and the expansion and strengthening of health systems, especially in many southern countries. We will also increase our humanitarian assistance, knowing that this pandemic is having a dramatic impact. We also see, for example, that malaria is increasing in Africa. The damage that is also caused by the pandemic is much more diverse than just this pandemic itself. I consider today's conference to be a very important signal at a time when we are not always working together multilaterally in the way I would like . It's an hour of hope. Thank you to everyone who is there. Germany will actively contribute and follow the development. We know that this will not be the last conference of this kind and that more effort is needed. Thank you very much."
"4","https://www.bundesregierung.de/breg-de/aktuelles/rede-von-bundeskanzlerin-merkel-anlaesslich-der-wiederauffuellungskonferenz-der-impfallianz-gavi-am-4-juni-2020-videokonferenz--1757954","Rede von Bundeskanzlerin Merkel anlässlich der Wiederauffüllungskonferenz der Impfallianz GAVI am 4. Juni 2020 (Videokonferenz)",2020-06-04,"Sehr geehrter Herr Generalsekretär, lieber António Guterres,lieber Boris Johnson,Herr Berkley,Exzellenzen,meine Damen und Herren, ich möchte mich bei allen Beteiligten an dieser wirklich wichtigen Konferenz bedanken. Gemeinsam wollen und können wir die Voraussetzungen dafür schaffen, dass auch in den nächsten Jahren über 300 Millionen Kinder geimpft werden können, um sie vor lebensbedrohlichen Krankheiten zu schützen. Wir wollen und wir können so für über 300 Millionen junge Menschen die Chance auf eine gesunde Entwicklung erhöhen. 300 Millionen – das ist ja nicht nur einfach eine Zahl. Hinter dieser Zahl stehen individuelle Schicksale. Das dürfen wir bei aller Diskussion um Finanzen nicht vergessen. Durch COVID-19 ist die Arbeit von GAVI noch wichtiger geworden. Ein Virus, das sich weltweit ausbreitet, kann auch nur in gemeinsamer globaler Anstrengung wirksam bekämpft werden. Dazu gehört, Forschungsallianzen aufzubauen. Wir müssen Verfahren vereinfachen, um schneller Ergebnisse zu erzielen. Nicht zuletzt gilt es, Gesundheitsakteure wie GAVI zu stärken. Denn sobald ein geeigneter Impfstoff gefunden ist, müssen wir imstande sein, unverzüglich eine globale Impfkampagne zu starten. Dabei zählt jeder Tag. Impfschutz ist Lebensschutz. Dieser darf nicht davon abhängen, in welchem Land man lebt. Einsatzbereite Impfstoffe müssen in aller Welt bezahlbar, verfügbar und frei zugänglich sein. Das ist eine riesige Aufgabe. Dieser Aufgabe widmet sich GAVI seit nunmehr 20 Jahren – und das mit großem Erfolg. Bislang wurden insgesamt über 760 Millionen Kinder gegen gefährliche Krankheiten geimpft. So konnte zum Beispiel Polio nahezu ausgerottet werden. Es freut mich, dass Deutschland als einer der größten Unterstützer von GAVI seinen Beitrag dazu leisten konnte. Aber wir sehen, dass COVID-19 nun weitere Fortschritte gefährdet. Das Virus birgt nicht nur für sich allein betrachtet erhebliche Gesundheitsrisiken. Die Pandemie beeinträchtigt auch verschiedenste andere Gesundheitsmaßnahmen – zum Beispiel Immunisierungsprogramme gegen Masern und TBC. Die Ausbreitung anderer Infektionskrankheiten droht also wieder zuzunehmen. Schätzungen der WHO zufolge könnten hiervon bis zu 80 Millionen Kinder betroffen sein. Das heißt: Wir dürfen die Standard-Impfprogramme nicht vernachlässigen. GAVI muss auch bisherigen Aufgaben weiter erfolgreich nachgehen können. Deshalb wird Deutschland die Impfallianz auch in den nächsten fünf Jahren mit 600 Millionen Euro unterstützen. Hinzu kommen 100 Millionen Euro, die Deutschland im Rahmen der COVID-19-Geberkonferenz der EU zugesagt hat. Gemeinsam können wir es schaffen, Infektionskrankheiten ihren Schrecken zu nehmen. Wo ein Wille ist, ist auch ein Weg. Und mit GAVI haben wir gleichsam einen hilfreichen Wegweiser. Daher wünsche ich der Impfallianz und letztlich uns allen eine erfolgreiche Konferenz. Von Herzen danke ich allen, die daran mitwirken.","Speech by Chancellor Merkel on the occasion of the GAVI vaccination alliance replenishment conference on June 4, 2020 (video conference)","Dear Secretary General, dear António Guterres, dear Boris Johnson, Mr Berkley, Excellencies, ladies and gentlemen, I would like to thank everyone involved in this really important conference. Together we want to and can create the conditions so that over 300 million children can be vaccinated in the next few years to protect them from life-threatening diseases. We want and we can increase the chance of healthy development for over 300 million young people. 300 million – that's not just a number. Behind this number are individual destinies. We must not forget this in all discussions about finances. COVID-19 has made GAVI's work even more important. A virus that is spreading worldwide can only be combated effectively with a joint global effort. This includes building research alliances. We need to simplify procedures to get results faster. Last but not least, it is important to strengthen health players such as GAVI. Because as soon as a suitable vaccine is found, we must be able to start a global vaccination campaign immediately. Every day counts. Protection against vaccination is protection of life. It shouldn't depend on the country you live in. Ready-to-use vaccines must be affordable, available and freely accessible anywhere in the world. It's a huge task. GAVI has been dedicated to this task for 20 years now - and with great success. To date, more than 760 million children have been vaccinated against dangerous diseases. For example, polio has been almost eradicated. I am pleased that Germany, as one of the biggest supporters of GAVI, was able to make its contribution. But we see that COVID-19 is now jeopardizing further progress. The virus does not only pose significant health risks on its own. The pandemic is also disrupting a variety of other public health efforts, such as immunization programs against measles and tuberculosis. The spread of other infectious diseases is therefore threatening to increase again. According to WHO estimates, up to 80 million children could be affected. That means: We must not neglect the standard vaccination programs. GAVI must also be able to continue to successfully pursue previous tasks. That is why Germany will continue to support the vaccination alliance with 600 million euros over the next five years. There are also 100 million euros that Germany pledged to the EU as part of the COVID-19 donor conference. Together we can make infectious diseases less scary. Where there is a will, there's a way. And with GAVI we have a helpful guide, so to speak. I therefore wish the Vaccine Alliance and ultimately all of us a successful conference. I sincerely thank everyone who is involved in this."
